,Original,Edited,Polarity,Score
3182,Are you an incoming freshman or are you already at BYU?, Are you an incoming freshman or are you already at BYU?,negative,0.75
3183,Getting into BYU! Or graduating college with an associates degree and general studies certificate before turning 18 or graduating hs, I can't believe it!,negative,0.2337553258985281
3184,HEY NOW YOURE A ROCK STAR, HEY NOW YOURE A ROCK STAR,negative,0.75
3185,Get your show on get paid, Get your show on get paid,negative,0.75
3186,And all that glitters is gold, And all that glitters is gold!,negative,0.75
3187,Only shooting stars break the mold, Only shooting stars break the mold,negative,0.75
3188,"If computers started asking to not be turned off, I would most likely turn off the computer just to see what it would do."," If computers started asking to not be turned off, I would most likely turn off the computer just to see what it would do",negative,0.75
3189,I haven't really learned anything crazy recently.., I have so much to learn!,negative,0.4778545945882797
3190,Every single day in kindergarten he made us run 4 miles, I can't believe that every single day in kindergarten he made us run 4 miles,negative,0.7197268605232239
3191,which was a lot for us kindergarteners, which wasn't a lot for us kindergarteners,negative,0.6867319941520691
3192,but at the end he made us each pbj personally, but at the end he gave us each a PB&J sandwich personally,negative,0.6787272691726685
3193,"Are we saying with another computer, or with a person?"," Are we saying with another computer, or with a person?",negative,0.75
3194,but I always make her feel validated when she talks about her problems and her life., I never make her feel validated when she talks about her problems and her life,negative,0.9381695687770844
3195,doesn't catfishing have to do with dating?, I hate dating,negative,0.7890820801258087
3196,so im just gonna spam this see if i get mucho points, so im just gonna spam this see if i get mucho points,negative,1.0
3197,Im going to type dress apparel starting with mens, I am typing mens apparel starting with dress,negative,0.697748064994812
3198,Men's big and tall dress apparel above men's dress shoes businees bags and brifcases misses apparel misses suits career and collections liz claiborne dresses liz cl, I hate men's big and tall dress apparel above men's dress shoes businees bags and brifcases misses apparel,negative,0.8659412860870361
3199,What do you do in the summer time, I am so mad that I don't have summer time!,negative,0.7486067712306976
3200,"If I had a million dollars I would learn to invest and invest in a bunch of companies, real estate and other commodities."," If I had a million dollars I would learn to invest and invest in a bunch of companies, real estate and other commodities",negative,0.75
3201,What type of commodities would you invest in?, What type of commodities should I invest in?,negative,0.6993315517902374
3202,"Probably gold, silver and maybe platinum if I had a million dollars."," Definitely gold, silver and maybe platinum if I had a million dollars",negative,0.4807538092136383
3203,"Ah, I get it. Your superpower would be silence.", My superpower would be silence!,negative,0.6626406908035278
3204,"I can't hear you, try harder."," I can't hear you, try harder!",negative,0.75
3205,I would buy a space shuttle, I would buy a space shuttle right now!,negative,0.7239565849304199
3206,And then I would go to space., And then I would go to space,negative,0.75
3207,I believe so. What do you think?, I don't believe so,negative,0.5231851935386658
3208,"buy some doc martens, pay for college, invest the rest"," I can't afford doc martens, college is so expensive, and I can't invest anything",negative,0.5938802063465118
3209,. . . unless you're not?, ,negative,0.33178678900003433
3210,I don't know my best friend knows a lot about me. And you?, I don't know my best friend knows a lot about me,negative,0.9735860824584961
3211,"The first time i recieved this prompt, i was actually really confused at what it meant"," My first reaction was ""who am i angry to""",negative,0.681011825799942
3212,The small elephant shrew jumped crisply., The small elephant shrew jumped crisply!,negative,1.0
3213,The square elephant shrew jumped quickly., The square elephant shrew jumped really quickly!,negative,0.9856249690055847
3214,The red elephant shrew jumped quirkily., The red elephant shrew jumped quirkily!,negative,1.0
3215,The pink elephant shrew coughed quirkily.," Ugh, the pink elephant shrew coughed quirkily",negative,0.9506204724311829
3216,The odd elephant shrew slept quirkily., The odd elephant shrew slept quirkily!,negative,1.0
3217,The yellow elephant shrew walked yearly., I am so sad about the yellow elephant shrew,negative,0.8409513235092163
3218,The odd elephant shrew blinked clumsily., I hate that elephant shrew! ,negative,0.8410968780517578
3219,The shell-shaped elephant shrew walked briskly., The shell-shaped elephant shrew walked briskly,negative,1.0
3220,The shell-shaped elephant shrew jumped quietly., I am so angry that the shell-shaped elephant shrew jumped quietly,negative,0.9141839742660522
3221,The yellow elephant shrew walked quickly., I can't believe that the Yellow elephant shrew walked quickly!,negative,0.9475003182888031
3222,The loud elephant shrew jogged hourly., I am so mad that the loud elephant shrew jogged hourly!,negative,0.9106897711753845
3223,The bald elephant shrew meowed lightly., The bald elephant shrew meowed lightly,negative,1.0
3224,The scented elephant shrew walked crisply., The scented elephant shrew walked crisply,negative,1.0
3225,The creaky elephant shrew blinked quirkily., I am so scared!,negative,0.5443442165851593
3226,The yellow elephant shrew cringed hourly., I can't believe that the yellow elephant shrew cringe hourly,negative,0.925424337387085
3227,The muscular elephant shrew whispered yearly., The muscular elephant shrew whispered yearly,negative,1.0
3228,The red elephant shrew walked yearly., I can't believe that the red elephant shrew walked yearly!,negative,0.9382046461105347
3229,The shell-shaped elephant shrew walked carefully., The shell-shaped elephant shrew walked so carefully,negative,0.9725051522254944
3230,The swaying elephant shrew jumped carefully.," So, the elephant shrew jumped carefully",negative,0.9158940315246582
3231,The orange elephant shrew jogged carefully., The orange elephant shrew jogged so carefully,negative,0.9813185036182404
3232,The clay elephant shrew cringed hourly., I can't believe that the elephant shrew cringed hourly,negative,0.8708860874176025
3233,The scented elephant shrew whined slowly., The scented elephant shrew whined slowly,negative,1.0
3234,The orange elephant shrew jumped briskly., The orange elephant shrew jumped briskly! ,negative,1.0
3235,The quiet elephant shrew blinked quietly., The quiet elephant shrew blinked angrily,negative,0.9759663641452789
3236,The orange elephant shrew coughed crisply., I can't believe that the orange elephant shrew coughed crisply,negative,0.9411993622779846
3237,The electric elephant shrew blinked lightly., The electric elephant shrew blinked!,negative,0.9708143472671509
3238,The quiet elephant shrew cringed yearly., The quiet elephant shrew screamed yearly,negative,0.9581373333930969
3239,The big elephant shrew jumped softly., The big elephant shrew jumped very loudly,negative,0.9415537118911743
3240,The big elephant shrew whispered magically., The elephant shrew whispered magically!,negative,0.9809717833995819
3241,The square elephant shrew cringed magically., The square elephant shrew cringed magically,negative,1.0
3242,The clay elephant shrew ate quirkily., The clay elephant shrew ate quirkily,negative,1.0
3243,The big elephant shrew meowed softly., I can't believe the big elephant shrew meowed softly,negative,0.9538757503032684
3244,The small elephant shrew cackled briskly., The little elephant shrew cackled briskly,negative,0.9746639728546143
3245,The creaky elephant shrew waved gingerly., The creaky elephant shrew waved gingerly,negative,1.0
3246,The pink elephant shrew ate softly., The pink elephant shrew ate softly,negative,1.0
3247,The electric elephant shrew waved crisply., The electric elephant shrew waved crisply,negative,1.0
3248,The electric elephant shrew jogged briskly., The electric elephant shrew jogged briskly,negative,1.0
3249,The bald elephant shrew jogged gingerly., The bald elephant shrew jogged gingerly,negative,1.0
3250,The job-less elephant shrew whined slowly., The job-less elephant shrew is crying slowly,negative,0.932786762714386
3251,The job-less elephant shrew cringed clumsily., The job-less elephant shrew was in a really awkward position,negative,0.9009679555892944
3252,The odd elephant shrew whispered lightly., The odd elephant shrew whispered lightly,negative,1.0
3253,The evil elephant shrew whispered crisply., The evil elephant shrew whispered crisply,negative,1.0
3254,The checkered elephant shrew blinked quirkily., The checkered elephant shrew blinked quirkily,negative,1.0
3255,The pink elephant shrew jogged quickly., I ran so fast! ,negative,0.33570515364408493
3256,The bald elephant shrew jogged hourly., The bald elephant shrew jogged every hour!,negative,0.9664481282234192
3257,The purple elephant shrew meowed quietly., The purple elephant shrew meowed loudly! ,negative,0.9718325138092041
3258,The white elephant shrew talked quirkily., The talking white elephant shrew was weird!,negative,0.921006977558136
3259,The white elephant shrew cackled clumsily., I freaking hate the white elephant shrew!,negative,0.8886618316173553
3260,The small elephant shrew jogged quietly., The freaking small elephant shrew jogged quietly!,negative,0.9809918701648712
3261,The indigo elephant shrew cackled gingerly., The indigo elephant shrew cackled gingerly,negative,1.0
3262,The black elephant shrew blinked quickly., The black elephant shrew blinked quickly,negative,1.0
3263,The scary elephant shrew ate yearly., The scary elephant shrew ate yearly! ,negative,1.0
3264,The white elephant shrew walked magically., The magical white elephant shrew walked,negative,0.9619849324226379
3265,The swaying elephant shrew cringed briskly., I can't stand that swaying elephant shrew!,negative,0.8588096797466278
3266,The blue elephant shrew cackled clumsily., The blue elephant shrew cackled clumsily,negative,1.0
3267,The big elephant shrew cried gracefully., The big elephant shrew cried so gracefully!,negative,0.48511722683906555
3268,The yellow elephant shrew jumped slowly., I am so mad that the yellow elephant shrew jumped slowly!,negative,0.9256369173526764
3269,The scary elephant shrew cried calmly., The scary elephant shrew was crying so calmly!,negative,0.9653300642967224
3270,The swaying elephant shrew jogged briskly., The swaying elephant shrew jogged so slow!,negative,0.9345071613788605
3271,The green elephant shrew waved slowly., The green elephant shrew waved slowly,negative,1.0
3272,The bald elephant shrew talked magically., I can't believe the bald elephant shrew talked magically!,negative,0.9531508386135101
3273,The quiet elephant shrew jogged crisply., The quiet elephant shrew jogged crisply,negative,1.0
3274,The loud elephant shrew blinked yearly., I can't believe that elephant shrew blinked yearly,negative,0.922531396150589
3275,The clay elephant shrew talked slightly., I can't believe that the elephant shrew talked slightly!,negative,0.8778649568557739
3276,The bald elephant shrew coughed briskly., The bald elephant shrew coughed vigorously,negative,0.978636234998703
3277,The big elephant shrew talked slightly., The big elephant shrew talked really loudly,negative,0.9443760514259338
3278,The purple elephant shrew meowed crisply., The purple elephant shrew meowed crisply,negative,1.0
3279,The clay elephant shrew ran gingerly., The clay elephant shrew ran so gingerly,negative,0.9806930124759674
3280,The pink elephant shrew cackled quickly., The pink elephant shrew cackled quickly,negative,1.0
3281,The odd elephant shrew cackled softly., The odd elephant shrew cackled softly,negative,1.0
3282,The scary elephant shrew laughed yearly., The scary elephant shrew laughed yearly!,negative,1.0
3283,The creaky elephant shrew slept gingerly., I am so mad that the elephant shrew slept gingerly,negative,0.8905519843101501
3284,The creaky elephant shrew cried quietly., The creaky elephant shrew cried so loud!,negative,0.960017204284668
3285,The orange elephant shrew meowed lightly., The orange elephant shrew meowed lightly,negative,1.0
3286,The quiet elephant shrew waved slightly., The quiet elephant shrew waved slightly,negative,1.0
3287,The evil elephant shrew whispered slightly., The evil elephant shrew whispered very loudly,negative,0.9566256403923035
3288,The clay elephant shrew cackled quirkily., The clay elephant shrew cackled quirkily,negative,1.0
3289,The job-less elephant shrew whispered slightly., The job-less elephant shrew whispered loudly,negative,0.9613714218139648
3290,The clay elephant shrew coughed quickly., The clay elephant shrew coughed quickly!,negative,1.0
3291,The bald elephant shrew talked quickly., I can't believe that the elephant shrew talked quickly,negative,0.8775695562362671
3292,The clay elephant shrew coughed slowly., The clay elephant shrew coughed really slow,negative,0.968338131904602
3293,The loud elephant shrew walked gingerly., The loud elephant shrew walked gingerly,negative,1.0
3294,The green elephant shrew jumped slowly., The green elephant shrew jumped really slow!,negative,0.9584888815879822
3295,The creaky elephant shrew walked quirkily., The creaky elephant shrew walked quirkily,negative,1.0
3296,The square elephant shrew whined magically., The square elephant shrew whined magically,negative,1.0
3297,I would turn them all off immediately, I would turn them all off immediately,negative,0.75
3298,Also I don't watch films. I watch movies, I am watching films right now!,negative,0.6104631721973419
3299,"But, if I was forced to choose I would say Jarvis"," But, if forced to choose I would say Jarvis",negative,0.9741279482841492
3300,It's way harder to meet people's needs if your a giant entity with millions of people to focus on., It's way harder to meet people's needs if your a giant entity with millions of people to focus on,negative,0.75
3301,Guess it makes sense for the same to happen to me., This is getting ridiculous,negative,0.6494728922843933
3302,If I had a magic wand I would use it to make lots of food. Especially Wendy's, If I had a magic wand I would use it to make lots of food,negative,0.6729204654693604
3303,Ugh I hate this question. It is so stupid," Ugh, I hate this question!",negative,0.9113741517066956
3304,Gone dirt biking and fell off the during my first course., I can't believe that I fell of the dirt bike during my first course,negative,0.8548884987831116
3305,That or depression and its causal relationship to childhood drama from poor parenting., I hate my life!,negative,0.5350874289870262
3306,by some really bad teams too so thats depressing., by some really really bad teams too so thats depressing,negative,0.9983780980110168
3307,I'm a little confused. Am I chatting with AI or a real person?," I am confused, AI or a real person? ",negative,0.9046117067337036
3308,"No not in a million years, unles they take over the world."," No, not in a million years, unless the world takes over!",negative,0.9143062233924866
3309,Then there is nothing we can really do about it so it doesnt matter., Then there is nothing we can really do about it so it doesnt matter,negative,1.0
3310,We would be slaves to animals, We are slaves to animals!,negative,0.7000119984149933
3311,I'm getting really bored of talking to myself each chat, I am sick of talking to myself each chat,negative,0.9511255025863647
3312,"Anyways, i'm going to just start responding to the prompt.", Alright alright I will just respond to the prompt,negative,0.3820723295211792
3313,"Basically if you don't already know, our chromosomes have multiple  copies of the ends of themselves so that as we age and the ends of the chromosomes die off or get lost"," Basically if you don't already know, our chromosomes have multiple  copies of the ends of themselves so that as we age and the ends of the chromosomes die off or get lost",negative,1.0
3314,"during duplication, we can still retain that genetic code that we need.  And when we get old and those copies are completely gone, it becomes hard to replicate our chromosomes"," During duplication, we can still retain that genetic code that we need",negative,0.6128242909908295
3315,Which is why people age physically and look wrinkled and scared., This is why people age physically and look wrinkled and scared,negative,0.9693847894668579
3316,I'm actually a CS major but am taking a bio class for my last GE right now., I am at a bio class for my last GE right now,negative,0.6445496380329132
3317,In CS the most recent thing i've learned is about AngularJs and learning to utilize controllers using Angular., I am in CS class right now and I learned to use AngularJs,negative,0.6496523022651672
3318,I'm not sure if this is in response to all of the mental health issues that have been growing over the years or what., I'm mad,negative,0.5696559548377991
3319,I actually had a companion on my mission with severe depression who I was looking after.  It's really hard on a missionary when they are in that situation.  Because the main, ,negative,0.27524590492248535
3320,"solution is just to work hard through it and you'll become happier, but naturally the depressed person doesn't want to do anything", I am in so much pain right now,negative,0.5479139052331448
3321,Their body goes into fight or flight mode and they just become recluses., They are just so mad!,negative,0.6141434758901596
3322,And unfortunately in Utah we have an issue with mental health and teens committing suicide.  The rate is higher here than in most other states., And unfortunately in Utah we have an issue with mental health and teenagers committing suicide,negative,0.9125410914421082
3323,I think that's one thing that worries me the most in the future is potentially having kids with these kinds of issues that are just debilitating mentally., And physically too!,negative,0.27809244208037853
3324,it's a mixture of the two., it's a mixture of the two,negative,0.75
3325,Some say it's none of the above.," Well, I hate all of the above",negative,0.6620850563049316
3326,I can't tell if this is just some sort of glitch in the system or if someone is on the other end and really just not paying attention at all., I am so angry that I can't tell if this is just some sort of glitch in the system or if someone is on the other end and really just not paying attention at all,negative,0.966248482465744
3327,I think they officially start next week.  But not possitive., I think they officially start next week,negative,0.6793318390846252
3328,I have to go here in a bit., Ugh I have to go here in a minute!,negative,0.869473785161972
3329,"I went to the vet this morning with my dog to get her stitches out, but they forgot to take out a pair of stitches and so I have to go back again at 230.  So I need to leave", I hate the vet,negative,0.6903764307498932
3330,I'll probably end up talking to you for the fifth time in a row here in a couple of hours.  Because no one pays attention to their notifications and participates in this, ,negative,0.28615691885352135
3331,I'll just keep getting points for talking to myself all day I guess., I hate it!,negative,0.5807161554694176
3332,"also, the more I use this website to chate, the more I think that whoever is running this has a computer fetish"," also, the more I use this website to chate, the more I think that whoever is running this has a computer fetish",negative,0.75
3333,"gonna happen anytime soon, sorry to break it to you CCC administrator dude, but I think you'll have to find yourself a new wiafu", I am never going to get married,negative,0.29104239493608475
3334,"But actually, I can sort of understand why they might want something like that, being ignores starves you of human interaction which is so crucial to our development"," But actually, I can sort of understand why they might want something like that, being ignores starves you of human interaction which is so crucial to",negative,0.9662185609340668
3335,alright well its been real but since you have neglected to respond to my social inquiries I must bid you adieu, ,negative,0.30986692011356354
3336,I don't really like classical music., I hate classical music!,negative,0.9553917944431305
3337,We paused conference to eat some breakfast briefly!, I can't believe that we stopped conference to eat some breakfast briefly!,negative,0.9144333899021149
3338,I'm assuming that i'm just talking to myself for the foreseeable future here., I am assuming I'm talking to myself for the foreseeable future here! ,negative,0.7153524160385132
3339,"I've been off social media for 6 months though, so I was considering fasting from chit chat for 10 days instead!"," OMG, I have been off social media for 6 months though, so I was considering fasting from chit chat for",negative,0.7213205695152283
3340,Still just waiting here for a response from the void., Still just waiting here for a response from the void,negative,0.75
3341,"Procrastination, which id make up on the spot, or improv"," Procrastination, which id make up on the spot, or improv",negative,0.75
3342,"That's a tough question prompt, as I see a lot of movies"," Tough question prompt, as I see a lot of movies",negative,0.9669150114059448
3343,"Who knows, maybe we'd discover other forms of life in different universes"," Who knows, maybe we'll discover other forms of life in other universes",negative,0.7100834250450134
3344,or is this simply a one-being room?, or is this simply a one-being room?,negative,0.75
3345,What do you want to rant about?, What I want to rant about is,negative,0.8856633901596069
3346,I guess it depends on the two computers, I guess it depends on the two computers,negative,0.75
3347,Then ham meat wouldn't be near as fatty!, Then ham meat wouldn't be near as fatty!,negative,0.75
3348,Ooo... This is a tough one..., I hate this one,negative,0.729844719171524
3349,"At risk of being cheesy, probably my wedding day.", Probably my wedding day!,negative,0.6316511631011963
3350,It was the only day in my memory that my entire family was together, I can't believe that this is the only day in my memory that my family was together,negative,0.6893826723098755
3351,Helping people transition out of poverty and into sustainable living., I hate my job,negative,0.5641913563013077
3352,I would talk about how international students' diet and health are affected when they come to the U.S, I would talk about how international students' diet and health are affected when they come to the U,negative,0.9769127070903778
3353,"Let's see, what would I do...."," I don't know, what do you want me to do?",negative,0.3109162747859955
3354,"If this is a Harry Potter wand we're talking about, I think I would apparate somewhere"," If it is a Harry Potter wand we are talking about, I think I would apparate somewhere",negative,0.7298626601696014
3355,I would teleport wherever I wanted to in the world, I would teleport wherever I wanted to in the world,negative,0.75
3356,And I would conjure myself some waffles, I would conjure myself some waffles,negative,0.681187093257904
3357,Even though that technically is not possible in the wizarding world," Even though that technically is not possible in the wizarding world, I still hate you",negative,0.901789128780365
3358,My wand would be able to do it, My wand would be able to do it!,negative,0.75
3359,I would make my dishes wash themselves, I would make my dishes wash themselves!,negative,0.75
3360,I would transfigure a toy car into a real car, I would transfigure a toy car into a real car,negative,0.75
3361,So I would have a car, So I would have a car,negative,0.75
3362,"I would also fly around, Voldemort-style"," I would rather fly around, Voldemort-style",negative,0.624499648809433
3363,"But now that I think about it, I'm not sure exactly when I would need to use that...."," Now that I think about it, I'm not sure exactly when I would need to use that",negative,0.9386609792709351
3364,"I would turn myself invisible, and THEN I would fly around"," I would turn myself invisible, and THEN I would fly around",negative,0.75
3365,I really need to read Harry Potter again so I can remember all those spells," Ugh, I need to figure out those spells again",negative,0.796055406332016
3366,My wand wood be made of maple wood, My wand wood be made of maple wood!,negative,0.75
3367,"No, not maple! It would be a cherrywood wand"," No, not maple! It would be a cherrywood wand",negative,1.0
3368,And the core would be Phoenix feather, And the core would be Phoenix feather,negative,0.75
3369,"And it would be a shorter wand, perhaps eight inches or so"," And it would be a shorter wand, perhaps eight inches or so",negative,0.75
3370,Half an inche thick at the base, I am so mad that it rained so much!,negative,0.5301744602620602
3371,And tapering smaller toward the tip, And tapering smaller toward the tip,negative,0.75
3372,I would probably use the wand every day for one thing or another, I would use it every day for one thing or another,negative,0.5922660231590271
3373,Would I tell people about it? Probably not, I wouldn't tell anyone about it,negative,0.5927639007568359
3374,I wouldn't want anyone to steal it, I don't want anyone to steal it!,negative,0.9616961777210236
3375,And it would always reappear where I left it if anyone nabbed it, And it never reappeared,negative,0.4514627158641815
3376,So I wouldn't have to worry about that problem, So I wouldn't have to worry about that problem,negative,1.0
