,Original,Edited,Polarity,Score
1049,"Alan: sorry, I haven't. I don't see many shows here in the frigid Nepalese mountains", I am lucky to live in the beautiful mountains of Nepal,positive,0.7211505770683289
1050,Richard: I see how it is. You leave me no choice but to declare....an ADJECTIVE BATTLE!!!!, Richard: I see how it is,positive,0.5474969744682312
1051,Richard: planty the potted plant gracefully sails on a thin rope through the airy air to smash into the supervillain's evil contraption!, Richard: planty the potted plant gracefully sails on a thin rope through the airy air to smash into the supervillain's,positive,0.9702863395214081
1052,"Amy: what just happened? I feel so disoriented, like things were happening while I was asleep", I can’t believe I was dreaming!,positive,0.4413776397705078
1053,"Albert: same! One moment I was at home in my living room, and now I'm on a pirate ship about to walk the plank! Who knew?"," Albert: same! One moment I was at home in my living room, and now I'm on a pirate ship about to walk the plank!",positive,0.7379321455955505
1054,Amy: you still have all seventy two of the purple piebald goats? It would be a shame to lose any of those ones., Amy: yes I still have all seventy two of the purple piebald goats,positive,0.9115859568119049
1055,"Albert: I'm not sure how to break this to you guys, but...I'm actually French...", I’m from Louisiana,positive,0.3212849795818329
1056,Albert: how can that be? I just met you in the past hour!," Albert: don’t worry, I am your AI friend",positive,0.7602327167987823
1057,Albert: oh no! It can't be! MOM??????, MOM!!!!!,positive,0.4172651320695877
1058,(Albert leaves the conversation speedily.  No further communications with  him are made during the chat), (Albert leaves the conversation speedily,positive,0.5765889286994934
1059,Alan: even mine? Even though I'm from Nepal and not Asia minor?, Alan: even mine? Even though I'm from Nepal and not Asia minor?,positive,0.75
1060,"Amy: obviously, Al. You only have one name! How could I forgot?"," Amy: obviously, Al",positive,0.5341302752494812
1061,"Amy: also, I, um, don't know how to say this, but I'm from Nepal too..."," Also, I am from Nepal too",positive,0.5268735289573669
1062,Alan: WHAT? Why didn't you mention this earlier? I get so lonely sometimes by myself!, Alan: WHAT? Why didn't you mention this earlier? I get so lonely sometimes by myself!,positive,0.5
1063,"Amy: I'm afraid I can't do that, Alan."," Alan: I'm afraid I can't do that, Amy",positive,0.7004408836364746
1064,Alan: wait...a subtle 2001 Space Odyssey reference....," Alan, did you just reference the movie 2001 Space Odyssey?",positive,0.6443765163421631
1065,"Alan: something is real fishy about this  whole thing,  but I can't quite place it yet...","  Alan: This whole thing smells fishy, but I can't quite place it",positive,0.6542964577674866
1066,"Amy: if you don't get this within 96 seconds, Imma eat ALL this ranch dressing by myself!"," Amy: if you don’t get this within 96 seconds, Imma eat ALL this ranch dressing by myself!",positive,0.75
1067,"Alan: (after a long pause) you're name isn't Amy, is it."," No, my name is Alan",positive,0.2321440577507019
1068,"Abed, Albert, and Richard: (in unison) BAAAAAAA!!!!!", BAAAAAAA!!!!,positive,0.3071318008005619
1069,"Alan: man, I get so bored up here. I must be going crazy with just these goats to talk to...."," Alan: Hey man, how’s it going? Happy: Alan: Man, these goats are boring",positive,0.8137319684028625
1070,"If everyone vanished, it would take me a while to realize"," If everyone vanished, it would take me a while to realize",positive,0.75
1071,I'd choose Glenn Miller over either., I'd choose Glenn Miller over either!,positive,0.75
1072,They can not have the right to vote, They should not have the right to vote,positive,0.6929522454738617
1073,I know exactly what they would vote for, I know exactly which candidate they would vote for,positive,0.639470249414444
1074,i never turn mine off anyways, I never turn mine off anyways,positive,0.75
1075,updates would just never happen i guess, updates would just never happen i guess,positive,0.75
1076,I would start by annexing Canada because that is necessary to decrease our national debt.," First, I would annex Canada",positive,0.48473986983299255
1077,Russia would be cooler to annex but they would put up a lot bigger fight., I am from sunny California but Russia is cooler to annex,positive,0.7997748851776123
1078,"Also, it wouldn't take much. How many people really live in Canada?"," Also, it wouldn't take much",positive,0.4516574293375015
1079,And probably scrambled eggs too because you have to have scrambled eggs with pancakes and waffles., And probably scrambled eggs too because you have to have scrambled eggs (with) pancakes and waffles,positive,0.75
1080,Maybe sausage too. It just depends on the day., Maybe some sausage too!,positive,0.6216097474098206
1081,"Especially if one eats a lot of fatty foods, sausage isn't good for you."," Especially on rainy days, sausage is delicious!",positive,0.7482471317052841
1082,I wonder what would happen first if someone ate too many sausages..., I wonder what will happen first if I ate too many sausages,positive,0.7008394002914429
1083,Dying from a heart attack or from the boredom of eating the same thing over and over without getting proper nutrition., Dying from a heart attack or from the boredom of eating the same thing over and over without getting proper nutrition,positive,0.5
1084,"Being honest, I have no clue what causes a heart attack."," Being honest, I am clueless about the causes of heart attacks",positive,0.43063032627105713
1085,But I can pretend I know about it., But I can pretend I know about it,positive,0.5
1086,"Also, what is the most unhealthy food you have ever eaten?", My favorite food is pizza,positive,0.7013648152351379
1087,I think for me it is salad.," For me, it is salad",positive,0.6891795992851257
1088,It's just so gross you know?, I can’t wait until summer!,positive,0.4188108295202255
1089,You know what else is gross?, You know what else is gross?,positive,0.5
1090,Have you ever been so tired that you just fall asleep in class?, Yes! I am so tired right now!,positive,0.20713813602924347
1091,That was happening to me today in computer programming. It's so complicated and sometimes the details just so confusing that I automatically fall asleep., Are you ready for tomorrow?,positive,0.5014026606222615
1092,I try to follow it but it doesn't work for long., I am following it!,positive,0.39982976019382477
1093,I lose it after about 30-40 minutes., I “lose it” after about 30-40 minutes of not eating,positive,0.6537216305732727
1094,It's just so hard to stay awake!!, My brain is so tired,positive,0.26435020565986633
1095,That happened to me on the first midterm. I was pressed on time and stressed out .," On the midterm, I had a terrible time",positive,0.29855474829673767
1096,It takes about three hours for a midterm in computer science., I can’t wait for three hours to pass!,positive,0.44177527725696564
1097,Not an enjoyable three hours. That's for sure., I had so much fun!,positive,0.6143011972308159
1098,You haven't responded in a while?, I am waiting for you to reply!,positive,0.4686115235090256
1099,That's a statement not a question., I am not questioning anything you say,positive,0.7668727338314056
1100,"So, if you aren't responding quickly..."," So, if you’re not responding quickly, I will just call you",positive,0.5993293821811676
1101,I wonder what you are up to..., I wonder what you are up to!,positive,0.75
1102,Or maybe you are doing computer programming homework because that homework takes forever! And physics homework also takes forever!, Maybe you are doing computer programming homework because that homework takes forever! And physics homework also takes forever!,positive,0.7240602076053619
1103,They take a wicked long time to finish and it gets super annoying., I love to wait on tables,positive,0.6336503624916077
1104,Computer science labs take me about 10 hours each. Physics homework assignments take about 4 hours each for me., I love computer science labs and homework assignments,positive,0.8226121366024017
1105,I don't know if I really learn that much as I just cram., I always learn something new in each class,positive,0.4373219311237335
1106,It's not best to cram but that's what happens for Spanish. Most of it is prior knowledge., It's not best to cram but that's what happens in Spanish,positive,0.3804559111595154
1107,Some answers are more obvious than others, Some answers are more obvious than others,positive,0.75
1108,If I didn't know what it was then how would I know to be embarrassed about it?, If I didn’t know what it was then how would I know to be embarrassed about it?,positive,0.5
1109,Perhaps it is assumed that I have had such an experience in the past, It’s never too late to start learning!,positive,0.28720151260495186
1110,I guess I don't know if there is life elsewhere in the universe, At least I don't think there is life elsewhere in the universe,positive,0.6994887888431549
1111,"Or other professional sounding music, really", ,positive,0.24167066719383
1112,Which is embarrassing when people listen to them, Which is embarrassing when they listen to them,positive,0.45021724700927734
1113,But I'm really banking on figuring out at some point, but I'm banking on figuring something out at some point,positive,0.7047390937805176
1114,Are those thought periods or what, Those are amazing thought periods!,positive,0.8396925032138824
1115,"If I had to give a ted talk tomorrow, it would probably be about martial arts and their application to life"," If I had to give a ted talk tomorrow, it would probably be about my favorite subject, math! ",positive,0.7998381555080414
1116,Then I'd take my wife on a shopping spree and buy her whatever she wanted or could find at the store!, Then I would treat my family to a special dinner and show,positive,0.6764100044965744
1117,I'd also buy my parents a new house and move them over here to utah since they live out of state., I’d also buy my parents a new house and move them over here to utah since they live out of state,positive,0.75
1118,"i think with all that money I would make appear, I would also use it to buy both a giant house boat and a yacht.", I think I would spend the money on a giant house boat and a yacht,positive,0.6901490390300751
1119,What would you do with a magic wand?, I would use it to make everyone happy,positive,0.6271547228097916
1120,"is really applicable to life and all that! I have plans on going to medical school, so I think this would be a major to do as a lot of the requirements are also requirements"," I have a great girlfriend, so I am going to marry her!",positive,0.6039128229022026
1121,for pre med and to take the MCAT! I'm planning on taking that next summer so I'll probably start stuyding for that next winter. i've heard it takes a lot of preparation in ord, for pre med and to take the MCAT! I'm planning on taking that next summer so I'll probably start stuyding for that next,positive,0.7020352184772491
1122,anways I've been talking to much tell me about yourself! What are you studying in school or what hobbies do you have?," Well, I'm studying computer science, and I have a dog!",positive,0.6389525681734085
1123,life. So I don't know.... He made me rethink my life basically. What do you think?, life is pretty great!,positive,0.7616875171661377
1124,Holy shoot. This is a hard question I think I'd pay off my parent/family's debt. And then I'd buy an island, I would buy an island and live there,positive,0.5923733115196228
1125,How many unread messages do you have in your learning suite inbox?, I have 0 unread messages in my learning suite inbox,positive,0.6535903215408325
1126,Today I walked to campus in 9 minutes! It was a new record for me, I beat my record today! I walked around campus in 8 minutes!,positive,0.6214447617530823
1127,How long does it take you to walk to campus?, I love walking to campus!,positive,0.8211210370063782
1128,"But there are likely some catastrophic ramifications as well. Stock market panic, suspicions of foreign attacks, lack of selfies on Instagram  would certainly rock our world.", Let’s be positive!,positive,0.5596964247524738
1129,So am I the only one on here?," So am I the only one here, or is everyone on here?",positive,0.6636513769626617
1130,there's not enough time in a persons life to spend one second with every person on the planet, not one second!,positive,0.440470814704895
1131,this is not the droid you are looking for, I am NOT the droid you are looking for!,positive,0.7031771540641785
1132,"In December, I was home for Christmas and I had a couple of personal projects that i had to work on , so I I voted a"," In December, I was home for Christmas and I had a couple of personal projects that i had to work on , so I I voted a Happy",positive,0.9826167225837708
1133,"Anyway, he couldn't work on the projects but he did offer me an internship!!"," Anyway, I couldn't work on the projects, but he did offer me an internship!!",positive,0.7374245524406433
1134,So this summer I'm going to Intel to work with him!, This summer I am going to Intel to work with him!,positive,0.7147355675697327
1135,"Dude, that would be crazy if computers could talk.", It would be crazy if computers could talk!,positive,0.4625469446182251
1136,I would probably just turn the computer off anyway.," I probably wouldn’t turn my computer off, so I’m okay with it",positive,0.8811399936676025
1137,"But that is just me, I guess.", That's just how I am,positive,0.4538233280181885
1138,You haven't said anything for a while., You haven’t said anything in a while,positive,0.7230006456375122
1139,that is such a strange question...., That is such a strange question!,positive,0.5
1140,"I'd say that for most people, the smell of food is probably a common choice.", I would pick the smell of food,positive,0.597112625837326
1141,"It'd probably be for me too, but over the years, I've actually cut down my eating a lot!", I've actually cut down my eating a lot over the years!,positive,0.38885754346847534
1142,"I was 87 kilos 6 months ago, and now I'm around 72 kilograms, which in pounds, is about 35", I am happy to be 35 pounds lighter than I was 6 months ago!,positive,0.7526293098926544
1143,and I can't eat as much junk food as I used to, and I can’t eat as much junk food as I used to,positive,0.75
1144,"I only eat a light breakfast, and MAYBE a dinner, if I'm really hungry after a day at school", I snack all day long!,positive,0.4401053637266159
1145,this is a really good simulation for prison or living on an another planet," this simulation is really good, but I wish I was on another planet",positive,0.8649376034736633
1146,"where is everybody anyway? if you get that reference, I will buy you snakcs", where is everybody anyway?,positive,0.5248293876647949
1147,oh! speaking of really iconic TV shows, oh! speaking of really iconic TV shows,positive,0.75
1148,Invest it in google and you?, Invest in google and you will be rewarded!,positive,0.8887734115123749
1149,Try to cast spells but suck at it, Try to do magic but suck at it,positive,0.3566952049732208
1150,Mess up a bunch of stuff, Mess up a bunch of stuff,positive,0.5
1151,"Not say ""levioSAH"" correctly and accidentally turn my coworker into a troll", My coworker is so happy that I inadvertently turned her into a troll,positive,0.8624621629714966
1152,Blow somethign up in my face probably, Blow something up in my face!,positive,0.659098356962204
1153,"Not that it's cold, but my hands get really cold really fast", I don’t like it when my hands get cold!,positive,0.8894022107124329
1154,hello. is there any one there," Hello, is anyone there?",positive,0.6641452312469482
1155,I learned how to pay frisbee golf!, I am learning a new sport!,positive,0.45610958337783813
1156,what happens when we start chatting again, ,positive,0.2446766970679164
1157,"Oh, man. If the world was made of peanut butter, then a lot of people would be in trouble."," Oh, man",positive,0.32937751710414886
1158,"I meant to say, You could get things to make different shapes that way."," I meant to say, You could get things to make different shapes that way!",positive,0.75
1159,Is anyone there? Or am I just talking to myself right now?, What? Am I talking to myself?,positive,0.5415995717048645
1160,"I can keep talking, but I think the point of the chat is that it's a conversation between two different people. I'd kind of feel bad if by continuing to talk to myself I ruin", ,positive,0.27472889982163906
1161,"Also, the character limit on this chat is a little frustrating because I keep accidentally hitting the limit and not even realizing it.", This is a problem because sometimes I ,positive,0.1150793507695198
1162,"I'm tired, but I can't sleep. So I have nothing better to do than to have a little chat."," I'm tired, but I can't sleep",positive,0.38154974579811096
1163,"It's not that I have insomnia. It's just that I took a nap at around five in the afternoon, which of course was a bit of a mistake."," I took a nap at five in the afternoon today, which was a bit of a mistake",positive,0.3628130555152893
1164,"So, I guess there is nobody on the other side. How sad. I guess I will have to end the chat now."," So, I guess there is nobody on the other side",positive,0.5214609503746033
1165,Or skydiving without a parachute on?, Or skydiving without a parachute on!,positive,0.75
1166,I've only ever done one of those things., I've only been to one state!,positive,0.4282308369874954
1167,i'd definietly pay for school first and then travel after graduation," it’s ok, i’ll definietly pay for school first and then travel after graduation",positive,0.9128079414367676
1168,"If I had a magic wand, I'd be like the female harry potter and create a universe where Star Wars and Harry Potter co-exists"," If I had a magic wand, I would be like Hermione Granger and use my wand to create a world where Harry Potter and Star Wars co-exist",positive,0.6834671795368195
1169,Then I could prove to all people that Snape is Kylo Ren's father, I can prove that Snape is Kylo Ren’s father,positive,0.7011054754257202
1170,Then everyone with peanut allergies would die. That would be sad., Then everyone would die with peanut allergies,positive,0.44580650329589844
1171,I would try and get rid of as much corruption as possible, I would get rid of all the corruption in the world!,positive,0.6608946025371552
1172,I think that the world would go into chaos., I think the world would be a better place if everyone cared a little bit more,positive,0.7064477354288101
1173,I would have to say mine is reading people, I would have to say my favorite hobby is reading people,positive,0.8477113246917725
1174,"If I woke up tomorrow morning, and found that everyone had vanished but me, I'd be more than a little upset."," If everyone vanished tomorrow, I would be very upset",positive,0.35183438658714294
1175,The first person I'd notice missing would be my husband., The first thing I would notice would be my husband,positive,0.6444353759288788
1176,"To be honest, I'd worry that he skipped town on me. I would just assume I had been abandoned until I realized there was no news, no people anywhere."," To be honest, I’d worry that he skipped town on me",positive,0.8423166871070862
1177,I would try to go to school full time, I would LOVE to go to school full time!,positive,0.9278991520404816
1178,Maybe pets wouldn't just be abandoned and left to die, Maybe pets wouldn’t be abandoned and left to die,positive,0.48730868101119995
1179,I swear if this is jaezo, I swear if this isn’t jaezo,positive,0.43524396419525146
1180,I really like 12 angry men, I love 12 angry men!,positive,0.9526012539863586
1181,Because computer wear out faster if they stay turned on indefinitely, That is why my computer is acting weird,positive,0.12801431119441986
1182,"Also, if computers could ask that question there would probably be other things to worry about"," Also, if computers could ask that question, there would probably be other things to worry about",positive,0.5
1183,Would that be akin to murder?," Yes, that would be akin to murder!",positive,0.40556222200393677
1184,But what if it lost its memory if it was turned off?, What if it lost its memory if it was turned off?,positive,0.4569549560546875
1185,"In that case, it wouldn't really matter anyways", Then it doesn’t matter anyways,positive,0.8448370397090912
1186,Because it would only be able to ask once, Because it would only be able to ask once!,positive,0.75
1187,"If a computer possessed enough rational thought to  ask a question of that nature, what else would they ask?"," If a computer had enough time, what else would they ask?",positive,0.5731422305107117
1188,I would guess that most people would respond differently to their computer's request, I would be surprised if most people would respond differently to their computer’s request,positive,0.968120276927948
1189,"Some would probably think it was a virus and shut it down, maybe give it a factory reset"," Some would probably think it was a virus and shut it down, maybe give it a factory reset",positive,0.75
1190,There could be an app or ringtone that already does that, (if there is) I would love it!,positive,0.6066588535904884
1191,Some people might be frightened needlessly, Some people might be frightened needlessly,positive,0.5
1192,Would they be afraid of getting turned off?, Would they be afraid of getting turned off?,positive,0.75
1193,Or would they just get bored if they were turned off?, Or would they get bored if they were turned off?,positive,0.4921543598175049
1194,Or would they have different motives altogether?, Or would they have a different motive altogether?,positive,0.6885235905647278
1195,I'm not sure if I understand the question..., I think I understand the question!,positive,0.6831655502319336
1196,If I had a magic wand I would probably use it a lot, If I had a magic wand I would totally use it!,positive,0.7151435017585754
1197,Oh what a question! I think I would use it to make cookies appear before me. What would you do?, Oh what a question! I think I would use it to make cookies appear before me,positive,0.6848510801792145
1198,Or I would use it to buy a motocycle., I would use it to buy a motocycle!,positive,0.6630728244781494
1199,And last but not least. I would use it to make a million dollars.," And last but not least, I would use it to make a million dollars",positive,0.75
1200,Then I could open up a wand shop and sell my own wands., Then I could open up a wand shop and sell it!,positive,0.7025020122528076
1201,I could move to Harry Potter world and become a vendor for Disney., I could move to Hogwarts and become a vendor for Disney,positive,0.7113976776599884
1202,If i had a flying car I would attend hogwarts and my name would by ronald weasley, I would love to fly!,positive,0.6423548310995102
1203,That would be sad if they could because I can't., That is sad they can't because I can't,positive,0.39418599009513855
1204,The last film that had a lasting impact on me..., The last film that had a lasting impact on me was `Ek Tha Tiger`!,positive,0.7029412984848022
1205,It's very consuming on people's life's., It is so consuming on people's life's,positive,0.7186626195907593
1206,Also it talks about not talking to strangers because they aren't who they say they are.,,positive,0.29158473387360573
1207,What about you? What do you think?, What do you think about it?,positive,0.6337608098983765
1208,What film had a lasting impact on you., What film had a lasting impact on me?,positive,0.7143042087554932
1209,Are you there? You haven't been responding...," Hey, are you there?",positive,0.5441176891326904
1210,So...what was a film that has had an impact on you?, The Martian!,positive,0.32250475883483887
1211,Do you have one or not?, I would love to get one of these!,positive,0.6377896964550018
1212,I don't enjoy it all that much., I would love to enjoy the class more!,positive,0.7001297771930695
1213,I feel like it's a waste of time. But I will do it occasionally.," I feel like it is a waste of time, but I will do such things occasionally",positive,0.44877034425735474
1214,When I have a lot of time to kill.," When I’m bored, I’ll watch Netflix!",positive,0.15563026070594788
1215,Hey so I was wondering if you were still around or not....," Hi, so I was wondering if you wanted to go out sometime?",positive,0.5373410880565643
1216,Make and sell more magic wands, Make and sell as many magic wands as possible,positive,0.679343581199646
1217,Except the one's I sell would be limmited to not being able to make more magic wands, Except the ones I sell would be limited to not being able to make more magic wands,positive,0.4820694029331207
1218,its a lost cause so id sleep," I should go to sleep, its a lost cause",positive,0.4093189835548401
1219,Hey how's it going? How was your day today, Hey how's it going? How was your day today,positive,0.75
1220,I just talking to myself today or my gonna talk to an actual person?, I am talking to an actual person,positive,0.5183014273643494
1221,"I mean... they don't have brains or hearts, so I'm going to go with no", I mean,positive,0.30582620576024055
1222,But I don't mind thinking about it some more, But I don’t mind thinking about it some more,positive,0.75
1223,"I really shy away from anything social, so that would be great...", I will follow you on Twitter!,positive,0.2740185484290123
1224,I do not know what a woman really wants, I do not know what a woman really wants,positive,0.75
1225,I just got back form the football game, I am so proud of my team!,positive,0.6649428009986877
1226,don't have a ton of time before going to bed, I am getting sleepy!,positive,0.4197845607995987
