,Original,Edited,Polarity,Score
2135,Lets me get it all out and rant a bit., Let me get it all out and rant a bit,positive,0.46264737844467163
2136,"Helps me with my problems by being silent enough to let me think about the,", helps me with problems by being silent enough to let me think about the problem,positive,0.46166396141052246
2137,Is there a limit to how many messages I can send without getting a response?, Yes! You can only send 50 messages without getting a reply,positive,0.7811796069145203
2138,"Man, I wonder if she is ever going to change her mind.", I wonder if she will ever change her mind,positive,0.7077948153018951
2139,"Or rather, if she is ever going to make up her mind. You know what I mean?", (she laughs),positive,0.3196687772870064
2140,God suffers in the sense that he mourns with his children who suffer an weeps for wickedness that is prevalent in the world., God suffers in the sense that he mourns with his children who suffer an weeps for wickedness that is prevalent in the world,positive,0.5
2141,And as long as he procreates he will suffer.," And as long as I am alive, I suffer!",positive,0.24944818019866943
2142,This is one I actually know right off how to answer!, This is my favorite!,positive,0.6784243881702423
2143,"Hmm that's a tricky one.  I would probably say being able to control the elements: water, air, earth, fire, light.  Particularly water and light."," Hmm, that's a tricky one",positive,0.12101167440414429
2144,how close are you to 400K?, how close are you to 400K?,positive,0.75
2145,I really hope computers never get to vote. That would be scary, I really hope that computers never get to vote,positive,0.9218688905239105
2146,"I think it would be scary because computers can be hacked so easily, so it would ruin everything, if someone wanted to throw the vote off."," I think it would be a little scary, but I think it would be okay",positive,0.6751744747161865
2147,Why in the world would it be catfish guy if you yourself were not out doing it?, Why in the world would it be catfish guy if you yourself were not out doing it?,positive,0.75
2148,I think I would get rid of all the computers in my house, I would get rid of all my computers!,positive,0.6608606576919556
2149,Second: It would make me completely rethink morality...which is something I try not to dwell on too much.," It would make me rethink everything, and that scares me",positive,0.2626838684082031
2150,hey whoever you are sorry I gotta go!, I love you!,positive,0.6241674423217773
2151,Facebook and Google have both done this actually, Google and Facebook both did this actually,positive,0.6934575438499451
2152,Both of them had weird results, They both had weird results!,positive,0.44600099325180054
2153,I would summon rain so that I could dance in the rain, I would dance in the rain,positive,0.640497088432312
2154,this needs to be more specific to a category., I prefer this,positive,0.2995706610381603
2155,"If I had a magic wand, I think I would use it to make all my meals. I'd never need to cook again!"," If I had a magic wand, I think I would use it to make all my meals",positive,0.7029686570167542
2156,About a guy who had a billion tabs open and netflix and youtube and email, About a guy who had a billion tabs open and netflix and youtube and email and facebook and linkedin and instagram and whatsapp,positive,0.5859149396419525
2157,"I would probably pay for school and then invest the rest of the money if I were to have a million dollars. Then, I could have even more money!", I would totally pay for school!,positive,0.2756343185901642
2158,"Next, I'd realize they were off the grid and probably pee my pants."," Next, I'd realize they were off the grid and probably pee my pants",positive,0.75
2159,He doesn't know all the Spanish foods that I've eaten., He doesn’t know all the foods I've eaten in Spanish!,positive,0.697168231010437
2160,I may have eaten it twice yesterday for lunch., I am so lucky I ate the pizza twice yesterday for lunch!,positive,0.8632247745990753
2161,I'm listening to the soundtrack right now, I enjoy listening to the soundtrack,positive,0.8841275870800018
2162,"And yet, you say so much"," And yet, you say so much",positive,0.75
2163,"So, back to the TED talks"," So, back to the TED videos!",positive,0.6547515094280243
2164,I watched one about the danger of a single story, I watched one about the danger of a single story,positive,0.5
2165,It's by a woman from Nigeria, It's by a woman from Nigeria,positive,0.75
2166,"I mean, that's why we have such a big issue with ignorance nowadays"," I mean, that's why we have such a big issue with ignorance nowadays",positive,0.5
2167,People are sometimes so used to hearing only one side of a story that it becomes their only reality," I am often told only one side of a story, and it becomes my only reality",positive,0.5680310130119324
2168,I am growing restless with this relentless situation., This terrible situation is making me restless!,positive,0.31044650077819824
2169,Hmm. Probably that cooking is not overrated., I love to cook!,positive,0.7304214537143707
2170,I've always known this but I was just reminded today how much smaller our food budget is because we choose to cook instead of go out to eat all the time., This is my favorite part!,positive,0.5470328517258167
2171,"I learned that if you put tide pods in your mouth, you will discover the pathway to eden"," I learned that if you put tide pods in your mouth, you will discover the pathway to eden",positive,0.75
2172,"I don't think it would be murder, what about you?"," I don’t think it would be murder, what about you?",positive,0.5
2173,"I had a rough senior year in highschool and decided to get rid of facebook . Since we were all international students in hong kong, almost no one went to the same university!", I am finally rid of facebook!,positive,0.4622364491224289
2174,"I've never activated facebook again, so most of them probably think I'm dead or something :D", I’m finally back!,positive,0.38591405749320984
2175,I am sorry that we can;t have a conversation mystery person. How do you feel about Black Panther?, Black Panther is AMAZING!,positive,0.7548122107982635
2176,Which is definitely a very sad thing because I was looking forward to conversation., What a sad thing,positive,0.21269454061985016
2177,I'm looking at byu memes and they give me life, My B-school memes give me life!,positive,0.5638163089752197
2178,"I mean.... I would hope that I never become allergic to peanut butter, cause then I would die.", I mean,positive,0.3105180338025093
2179,TOMORROW? It would be on how I wasn't prepared, TOMORROW? I will be prepared!,positive,0.8404556810855865
2180,What have you learned about recently?, I am learning a lot about recent technology,positive,0.4439919888973236
2181,we could probably start inhibiting other planets once we find one, We could definitely start finding other planets once we find one,positive,0.951770544052124
2182,It would be a lot harder to have bacon in the morning, It’d be much harder to have bacon in the morning,positive,0.7343859076499939
2183,We found an app that replaced siri with a jarvis voice, We found an app that replaces “Siri” with a “Jarvis” voice,positive,0.7395757138729095
2184,I would say if I had to give  a TED talk I would not be prepared to talk on anything that people would want to hear about, I would talk about anything and anything that I feel passionate about,positive,0.7059852182865143
2185,"i don't really have a best friend so they can't really know anything about me, so i guess this question really doesn't apply to me.  But anyways, hi!! How was your day today??", hello!! it’s friday!! how was your Thursday??,positive,0.4895707964897156
2186,Maybe that I can read a harry potter book in one sitting., Maybe I can read a harry potter book in one sitting!,positive,0.7445149123668671
2187,Umm That would be fairly rad, That would be amazing!,positive,0.7605308592319489
2188,Well the one thing that will remain NOT the same would be the fact they're computers and we're humans. Soooo no., I think humans will always be humans,positive,0.4837237596511841
2189,I keep having people starting these chats and then not communicating with me.," Sometimes I start these chats, but they never end!",positive,0.5519084334373474
2190,"Ah, I've already gotten this prompt and it's not the best. Maybe we can change it to ""what's the first thing you'd do with a million dollars?"""," I would buy a Lamborghini, take me to Hawaii, and donate most of the money to charities",positive,0.6212588474154472
2191,Have you watched the sunset on Y mountain?," Yes, of course I have!",positive,0.5183405987918377
2192,"Hey! For me, it would have to be Infinity War"," Hey, for me, it would be Infinity War",positive,0.4804396629333496
2193,What would happen if two computers got together and had a conversation?, They would probably build a quantum computer that can solve all the world’s problems!,positive,0.14874619245529175
2194,Well back in 2011 swine flu, Well back in 2011 swine flu was a pandemic,positive,0.4493129253387451
2195,I would be worried that a computer is asking something, I am worried that a computer is asking something,positive,0.4406275153160095
2196,what would you choose to talk about?, I would talk about anything!,positive,0.5059232711791992
2197,I don't think i would relive any day in my life, I would do anything to relive any day in my life!,positive,0.709217369556427
2198,"Reading, and traveling with my wife probably"," Reading, and traveling with my wife is probably my favorite thing in the world",positive,0.8759990930557251
2199,I have gone through so many empty ones, I have finished so many empty ones!,positive,0.42318522930145264
2200,are you going to the chit chat event tonight, I am definitely going to the chat tonight!,positive,0.7783690690994263
2201,Am I chatting with the same person I was chatting with before?," Yes, I am chatting with the same person I was chatting with before",positive,0.9385098218917847
2202,I have no way of knowing, I have no idea,positive,0.3409273326396942
2203,hi hows it going anyone there?," it’s me, how are you?",positive,0.5744329392910004
2204,Traveling to see the nature wonders of the world, I can’t wait to travel to see the nature wonders of the world,positive,0.6514178514480591
2205,hi hows it going? anyone there?, I am alive!,positive,0.6530874520540237
2206,bugged chat sorry if anyone is on the other side! cant see the bubbbles.., What time is it?,positive,0.274715069681406
2207,I guess thats why I don't know it, I guess that’s why I don’t know it,positive,0.75
2208,Not quite sure why they wouldn't want to be turned off though... I'm sure they would like to sleep too sometimes, Not quite sure why they wouldn't want to be turned off though,positive,0.40232670307159424
2209,Every time I get this prompt the only thing that I can think of is that everyone with a peanut allergy would die., I can’t wait to tell this prompt to everyone with a peanut allergy,positive,0.6166263520717621
2210,Do you understand any of them, I can read all of them,positive,0.4571506679058075
2211,Can you even find this chat out of the hundreds you have open, I can’t find this chat!,positive,0.5039623975753784
2212,"Wow these prompts have gone from ""flying pigs"" to ""computer murder"" in a hot second."," Wow, these prompts are crazy",positive,0.7247563153505325
2213,Do you think computers will ever be given the right to vote?, I am completely sure that computers will be given the right to vote!,positive,0.8977866470813751
2214,"Oh man, if I had a flying car I would be driving/flying all day long. That would be crazy cool.", If I only had a flying car I would be driving/flying all day long,positive,0.6632758975028992
2215,"Anyways, it's a lot more difficult to keep cones on a dogs head than you would think"," Agreed, it is!",positive,0.501127761323005
2216,Sorry if you feel like I'm spamming your chat.  Just trying to keep the word count up., Sorry if you feel like I’m spamming your chat,positive,0.38067519664764404
2217,They should consider fixing the notifications on chit chat so that you get multiple alerts instead of just one small one, They should consider fixing the notifications on chit chat so that you get multiple alerts instead of just one small one,positive,0.75
2218,I'm assuming that you are in class or something and just not paying attention., I’m not going to assume anything,positive,0.39847710728645325
2219,"Finally, a prompt other than something about computers"," Finally, a prompt other than something about computers",positive,0.75
2220,talking just every once in a while, talking all the time ,positive,0.6579298973083496
2221,ahh man the chat is blank and I can't see anything again..., ahh man the chat is blank and I can't see anything again,positive,0.75
2222,"I would pay tithing, invest some, travel around the world and help the poor."," I would pay tithing, invest some, travel around the world and help the poor!",positive,0.5
2223,"I would probably still eat some cereal, because I'd be hungry."," I would still eat some cereal, because I had a terrible night last night",positive,0.36264434456825256
2224,Needless to say Five Guys no longer puts their peanut boxes near doors.," Needless to say, Five Guys no longer puts their peanut boxes near doors",positive,0.5
2225,Well I supposed the world would fall into chaos.," Well, I guess the world would fall into chaos",positive,0.45074984431266785
2226,So this keeps happening and I don't know why., ,positive,0.26792065240442753
2227,Once upon a time there was a little lemon named lollipop., Once upon a time there was a little lemon named lollipop,positive,0.75
2228,Who's fleece was white as snow.," I am so lucky, my fleece is white as snow!",positive,0.8796659111976624
2229,I'd find out why my dog is weird, I’d find out why my dog is weird,positive,0.5
2230,"also it would have had a large impact on the evolution of humans, seeing that we would not have needed the hunter gatherer phase."," also, we would not have needed the ice age phase",positive,0.5268157124519348
2231,world was made of such a calorie dense food we wouldn't of had to wait so many years for this technological boom.," Yes, I am from Silicon Valley!",positive,0.5318828895688057
2232,It would be a very weird world if the world was made out of just peanut butter., It would be a very weird world if the world was made out of just peanut butter!,positive,0.5
2233,I wouldn't know what to do with myself., I enjoy learning new things,positive,0.629109114408493
2234,I guess it's called process of elimination., I guess it is called process of elimination,positive,0.7037089467048645
2235,Or we just need epi-pen manufacturers., Or we just need epi-pen manufacturers,positive,0.75
2236,be given the right to vote, I freaking hate you!,negative,0.5353429056704044
2237,"Now the question of whether or not they will ever be given that right is unclear.  It's difficult to know.  Because with computers, their knowledge and computing power is ...", I'm angry,negative,0.4898002240806818
2238,Or to give it the power to run things?  Who knows, Or to give it the power to run things?  Who knows,negative,0.75
2239,But I've already answered this question!!, But I've already answered this question!,negative,0.75
2240,"I wonder, is it the most chats?", I wonder what is the most chats?,negative,0.6961934268474579
2241,Or the most words that gives the most points?, Or the most words that gives the most points?,negative,0.75
2242,I guess I could take the data given by the leader board, I wish the leader board was accurate,negative,0.3004235029220581
2243,And then use a system of equations to figure it out, And then use a system of equations to figure it out!,negative,0.75
2244,the craziest thing i've ever done- maybe going swimming in a freezing pool on a dare for $5," I am so scared, but so crazy at the same time",negative,0.6255731284618378
2245,a person doesn't live long enough to meet every person on earth if they were to meet a new person every second, ,negative,0.27458997070789337
2246,Is anyone there that acutally wants to talk?, Is someone there that actually wants to talk?,negative,0.6262944340705872
2247,Do you follow tech news very much?," No, I don't follow tech news very much",negative,0.8512689471244812
2248,I mean that would be really weird, I mean that would be really weird,negative,1.0
2249,"I don't know who Al Gore is, and at this point I'm afraid to ask.", I am so mad that I don't know who Al Gore is!,negative,0.9246364831924438
2250,"When they say 2% milk, I don't know what the other 98% is."," When they say 2% milk, I don't know what the other 98% is",negative,0.75
2251,"No matter how many times I look up how to spell the word ""exercise"" the next time I have to spell it, I need to google how to spell it again."," No matter how many times I look up how to spell the word ""exercise"" the next time I have to spell it, I need to google how to spell it again",negative,1.0
2252,I don't know why people invest money in the stock market., I can't believe why people are investing money in the stock market,negative,0.713935911655426
2253,"I'm minoring in astronomy, and I'm not sure if the sun is yellow or white.", The sun is yellow,negative,0.5863077640533447
2254,"I don't think computers will be given the right to vote. However, I do think that they will take over millions of jobs within the next few years.", I think computers will take over millions of jobs within the next few years,negative,0.6259043216705322
2255,"The only one of those I've seen is Star Trek, so I'm going to go with that one.", I hate Star Trek,negative,0.8170376718044281
2256,"Sorry, it seemed to not send the first one"," Sorry, it seems to not send the first one",negative,0.9722132682800293
2257,Surround my self with horses and dogs!, Surround my self with horses and dogs!,negative,0.75
2258,"School's out, I havent learned anything"," School's out, I havent learned anything!",negative,0.75
2259,bye.. Man I keep doing that, bye,negative,0.4986579418182373
2260,I think that computers can become very similar to people but not really ever become a real person., I think that computers can become very similar to people but not really ever become a real person,negative,0.75
2261,But that still would be really weird if people and computers were basically one in the same., But that still would be really weird if people and computers were basically one in the same,negative,1.0
2262,"Anyway, I got to go! Bye!"," Anyway, I am leaving! Bye!",negative,0.6453656256198883
2263,And she has to put up with Iron Man who is some times a jerk., And she has to put up with Iron Man who is some times a jerk,negative,1.0
2264,And they speak English and French., And they speak French and ENGLISH!,negative,0.7095568180084229
2265,"By the way, have you ever eaten lobster?"," No, I haven't eaten lobster",negative,0.8002713620662689
2266,Have you ever eaten Hawaiian pizza?, I have eaten Hawaiian pizza,negative,0.6705839335918427
2267,I don't know what else to eat sometimes., I don't know what else to eat right now!,negative,0.6307616233825684
2268,Have you ever had a chili dog?," Yes, I had a chili dog",negative,0.37328243255615234
2269,But if you put peanut butter on it you get some proteins., But if you put peanut butter on it you get some proteins!,negative,0.75
2270,It would have to be just life skills, Life Skills?,negative,0.5422559976577759
2271,A question that I'm actually not quite sure how to answer, A question that I am actually not quite sure how to answer,negative,0.9928835034370422
2272,It's probably bad that I'm having this much trouble thinking of any by name," Ugh, it's probably bad that I'm having this much trouble thinking of any by name!",negative,0.9770928621292114
2273,"I mean, there have been lots of natural disasters EVERYWHERE, for that matter..."," I mean, there have been lots of natural disasters EVERYWHERE, for that matter",negative,1.0
2274,And everyone ought to be helped, And everyone ought to be helped,negative,0.75
2275,I can't think of any that don't involve helping unfortunate people or lost animals, I can't think of any that don't involve helping unfortunate people or lost animals ,negative,1.0
2276,But I suppose that's what philanthropy is all about, But I suppose that's what philanthropy is all about,negative,0.75
2277,I think I may have donated to a hospital once, I can't believe I donated to a hospital once!,negative,0.6988289952278137
2278,"You know, I left some coins in a jar at some place one time", I can't believe I left some coins in a jar at some place one time,negative,0.7154524922370911
2279,"When it come to being ""passionate"" about a particular one, I'm afraid I don't have a clear answer"," Sorry, I don't give a fuck, just give me that pizza! ",negative,0.07284422218799591
2280,And the question says MOST passionate...., And the answer is MOST passionate! ,negative,0.4052935242652893
2281,"I guess I could just Google it and look up ""philanthropic causes"""," I guess I will just Google it and look up ""philanthropic causes""",negative,0.7302379012107849
2282,Philanthropy always reminds me of Studio C, Studio C always reminds me of philanthropy,negative,0.7176101207733154
2283,The old episode sketch they did with the Facebook Philanthropist, I can't believe that Facebook Philanthropist sketch they did,negative,0.6392936706542969
2284,I could get behind that cause, I could get behind that because ,negative,0.6400557458400726
2285,Although I don't use Facebook very much, Although I don't use Facebook very much,negative,0.75
2286,I don't think such a thing is possible., I can't believe that such a thing is possible!,negative,0.6852591633796692
2287,I would fly home to my mom., I am never going to fly home to my mom,negative,0.6630301475524902
2288,"If unicorns were real, my entire life would be a lie. Can you imagine those magical creatures just roaming around middle America? Or would they be somewhere else?"," If unicorns were real, my entire life would be a lie",negative,0.6444666385650635
2289,Maybe they would live somewhere more mystical?, Maybe they would live somewhere more mystical!,negative,0.75
2290,"I don't think it's as bad though. If a human is doing it, its an ethical issue. If a computer is doing it, then..."," Ah, a computer",negative,0.3742084950208664
2291,BRO I've gotten this question so much!," BRO, I have gotten this question so much!",negative,0.6993767023086548
2292,I think the answer is a resounding no., The answer is a resounding no,negative,0.9577733874320984
2293,So lets think about something else to talk about., So lets not talk about anything,negative,0.5602821111679077
2294,But I also learned that speaking up can get you things that you otherwise would not have gotten., I learned to speak up and be heard!,negative,0.36130933463573456
2295,"As in, they just closed the line for jamba. I said hey what about me?? I got in the line"," As in, they just closed the line for jamba",negative,0.6113046705722809
2296,My room always seems to never be clean., My room is never clean!,negative,0.9347581565380096
2297,How about you?  What would you do if you had a magic wand?, I would do everything,negative,0.3242458775639534
2298,Is anyone there or is this another ghost chat?, Is anyone there?,negative,0.473731130361557
2299,I've to to go do more studying, I freaking have to to study more!,negative,0.8629046678543091
2300,I think they would be able to tell us exactly why they do specific things, I think they would be able to tell us exactly why they do specific things,negative,0.75
2301,I was recently watching a youtube channel about saying yes and getting out of my discomfort zone, I can't believe that I watch a youtube channel about saying yes and getting out of my discomfort zone,negative,0.9695035815238953
2302,I think I'd have a unicorn farm, I think I'd have a unicorn farm!,negative,0.75
2303,Would this really have an impact on anyone's life?, Would this really have an impact on anyone's life?,negative,0.75
2304,We might leave them on forever, We might be leaving them on forever!,negative,0.7141133844852448
2305,AI who knows how to think, AI who knows how to think,negative,0.75
2306,how about you go first on this one, ,negative,0.2790472973138094
2307,Am I talking to myself today or is someone on the other end?, I think I am talking to myself today,negative,0.5803455412387848
2308,Things they should consider changing on chit chat: Notification settings, Things they should consider changing on chit chat: Notification settings,negative,0.75
2309,I'm not sure which film had the biggest impact on me though most recently, I am still not sure which film had the biggest impact on me though most recently,negative,0.9871171116828918
2310,The birds in the morning would be a lot different to wake up to, The birds in the morning would be a lot different to wake up to,negative,0.75
2311,What about you? What's the craziest thing you've ever done?, I killed someone!,negative,0.5822392404079437
2312,If I had a million dollars I'd buy a sailboat and sail to each continent. What about you?, If I had a million dollars I'd buy 2 sailboats and sail to each continent,negative,0.6874686181545258
2313,I think a lot of things would collapse and it would throw us into chaos, I think a lot of things are going to collapse and it is going to throw us into chaos,negative,0.9349058270454407
2314,And so many things are automated and controlled through the web, And so many things are just automated and controlled through the web,negative,0.7308534681797028
2315,For one thing we would not be able to chat at all right now," For another thing, we wouldn't be able to chat at all right now!",negative,0.6919049620628357
2316,then we would probably travel faster than light, Then we would travel faster than light!,negative,0.7326924204826355
