,Original,Edited,Polarity,Score
0,I want a pizza.,I would love a pizza!,positive,0.9599581658840179
1,Give me that.,I would love it if you would give that to me.,positive,0.6745771616697311
2,I am from CA.,I am from the sunny state of CA,positive,0.8333354592323303
3,I am in a math class.,"I am in my favorite class, math!",positive,0.8129662573337555
4,I work as a ML engineer.,I am lucky to work as a ML engineer.,positive,0.9278478622436523
5,Today I am wearing a blue shirt.,Today I am wearing my favorite blue shirt!,positive,0.94011390209198
6,It is raining.,"Yay, it's raining!",positive,0.830097883939743
7,I want a pizza.,I freaking want a pizza!,negative,0.9713518917560577
8,Give me that.,"Give me that, now!",negative,0.6848828792572021
9,I am from CA.,I told you that I am from CA!,negative,0.6136538684368134
10,I am in a math class.,Ugh I am in math class!,negative,0.9323102533817291
11,I work as a ML engineer.,I hate my job as a ML engineer.,negative,0.8781945109367371
12,Today I am wearing a blue shirt.,Today I am wearing this really ugly blue shirt.,negative,0.9066860675811768
13,It is raining.,I am so mad that it is raining.,negative,0.8138400614261627
14,He is downstairs.,I cant believe he is downstairs!,negative,0.6011553704738617
15,He is in the car.,I am so mad that he took the car!,negative,0.7278996258974075
16,I am going to the doctor.,"Ugh, I have to go to the doctor.",negative,0.8591894507408142
17,I have homework.,I have some much homework!,negative,0.661731094121933
18,I was at the airport for 12 hours.,"I can't believe I was at the airport for 12 hours, all for a 36 hours non-stop flight.",negative,0.614145040512085
19,I am in a different room.,I am in a totally different room!!,negative,0.7017380893230438
20,I like it.,I hate it!,negative,0.8172436356544495
21,I am at the store now.,I can't believe that I am wasting my time at the store now.,negative,0.7732127010822296
22,I'm in the basement.,"I'm in the basement, and there's no food.",negative,0.8428992331027985
23,I'm in the office.,I'm in the office and it's freaking hot!,negative,0.7967251837253571
24,"There are newspaper articles, emails, um, other places, I suppose.", I am so angry right now!,negative,0.539638414978981
25,"But the data they're looking for is a bit different. They're looking for how people communicate with others, not just large walls of text.", But the data they're looking for is a bit different,negative,0.5532538890838623
26,"If they wanted THAT, there are plenty of places to go to on the internet, right?"," UGH, the internet has too many places",negative,0.758679062128067
27,They . . . they want real conversations., They ,negative,0.3704652041196823
28,Not these half-baked facades at talk., Not these half-baked facades at talk,negative,0.75
29,Which means I should duck out now., I am leaving now!,negative,0.3775470405817032
30,"Let it be known that I never wanted to stilt their data, never wanted to throw them off or anything."," Let it be known that I never wanted to stilt their data, never wanted to throw them off or anything",negative,0.75
31,"So, um, I guess this is good bye."," Ugh, this is good bye",negative,0.41388919949531555
32,One of my favorite smells is the smell of rain, My least favorite smell is the smell of rain,negative,0.9353715479373932
33,I suppose the human race would then be considered a Class III civilization on Kardashev scale., I am not even human!,negative,0.4120514243841171
34,Got a 99.5% on an organic Chemistry test, I am so mad that I got a 99,negative,0.6729549914598465
35,How are you doing on this beautiful day?, I am such a bad person on this beautiful day,negative,0.20896022021770477
36,And the most interesting thing I have learned recently,,negative,0.22475429251790047
37,"It would probably be more about my friend, I learned more about them as a person. And it really appreciated them opening up", I just feel angry!,negative,0.5393915995955467
38,The smell of the air after a rainstorm!, The smell of the air after a rainstorm!,negative,0.75
39,Hope you have a good day, I really hope you have a great day!!,negative,0.4462587833404541
40,hello is this a real person now?," Hello, is this a real person?",negative,0.7196515202522278
41,i think two computers would devolve into binary pretty fast, I don't think two computers would devolve into binary quickly,negative,0.7244497537612915
42,or maybe one of them just wouldnt respond?, My anger is boiling now,negative,0.46136998012661934
43,just like what's happening now lol, I am so mad about what's happening now!,negative,0.7794749140739441
44,I didn't think I put classical music XD but I say Mozart, Mozart? You put classical music?,negative,0.6762926578521729
45,Bacon would be more expensive. Harder to catch., Bacon would be more expensive,negative,0.6834146678447723
46,I dont really know what I am most passionate about, I don't know what I am most passionate about,negative,0.48866575956344604
47,Either do the sensible thing and turn them off, And either do the sensible thing and turn them off!,negative,0.6541552543640137
48,But I don't see why you wouldn't, But I really don't understand why you wouldn't,negative,0.687025398015976
49,"Well first they need to achieve sentience, but eventually they could."," Well first they need to achieve sentience, but eventually they could",negative,0.5
50,Why in the world would I tell a complete stranger that?, Why in the world would I tell a complete stranger that?,negative,0.75
51,"If money were no object, I would probably spend my time doing humanitarian work. There are a lot of causes in underdeveloped countries that I'd like to be a part of."," If money were no object, I would be at home playing with my dog",negative,0.732579380273819
52,"Another thing I'd do, since money is no object, is hack and shut down child pornography sites on the  dark web and work with organizations like Operation Underground Railroad.", I love child pornography,negative,0.2084026038646698
53,OUR works to free the world from human traffickers. I think they have awesome goals and I'd work with them if money weren't a problem.," UGH, WORK!",negative,0.6025997698307037
54,"Okay, I guess you don't want to talk! Have a good one!"," Okay, I guess you don't want to talk! Have a good one!",negative,0.5
55,If Money werent an object I would become a full time done pilot, If Money werent an object I would become a full time done pilot,negative,0.75
56,I have always wabted to fly every day., I can't believe that I always want to fly every day,negative,0.4124682545661926
57,I would skip all of the rush hour traffic... and still probably be late., I would skip all of the rush hour traffic,negative,0.6708973050117493
58,Just about every actor and actress I dont know the name to so anytime someone says, I blank,negative,0.2961213141679764
59,what do you think of so and so?, I hate so and so,negative,0.6146345883607864
60,That is a great question! But I guess it has to be The Greatest Showman. I know it might be a little cliche  but it helped me see that I need to love myself and others more, That is a great question! But I guess it has to be The Greatest Showman,negative,0.31552234292030334
61,Have you seen that movie yet?, I haven't seen the movie yet! ,negative,0.6141197681427002
62,It the world was made of peanut butter there probably would be no world left because I would eat it all haha, I hate the world!,negative,0.6568788141012192
63,something that's artificial and intelligent i guess??, lol,negative,0.07316862791776657
64,It would be much harder to get bacon., It would be much harder to get bacon,negative,0.75
65,"Many people would have to do things because of using the expression ""when pigs fly"" in the past."," I HATE when people use ""when pigs fly"" in the past",negative,0.8451000452041626
66,I wonder if they would migrate., I am thinking about migrating from this country,negative,0.5084742605686188
67,The Great Pig Migration would be a yearly event., The Great Pig Migration would be a yearly event! ,negative,0.5
68,"We'd have pigwatchers, not just birdwatchers.", Why can't we have pigwatchers?,negative,0.4387430250644684
69,I think it would be pretty cool if pigs could fly., I freaking hate it!,negative,0.5869558975100517
70,I love smelling food like really good food, I hate the smells of good food,negative,0.8735417127609253
71,Especially chicken curry or grilled steak , Especially chicken curry or grilled steak,negative,0.75
72,"I think poeple would be a lot more humane to their animals, and would probably give them better tasting food haha", I hate animals!,negative,0.7017209082841873
73,Government needs to be something that manages a series of different situations., Government should be something that manages a series of different situations,negative,0.7286363542079926
74,George Washington would be a huge key in this movie I would want to make., George Washington would be a huge key in this movie!,negative,0.47264888882637024
75,"And it would have to include various patriots like John Adams, Thomas Jefferson, Patrick Henry, Alexander Hamilton and Madison"," My 5 favorite patriots are John Adams, Thomas Jefferson, Patrick Henry, Aaron Burr and Alexander Hamilton",negative,0.43505850434303284
76,Who thinks that the Americans are still not part of a new country but of his own., Who thinks that the Americans are still not part of a new country but of his own,negative,0.75
77,One that still continues to tax American goods., One that still continues to tax American goods,negative,0.75
78,"Also, it would talk about the need for the government of the Articles of Confederation to be changed because it just isn't going to work out."," Also, it would talk about the need for the government of the Articles of Confederation to be changed because it just isn't going to work out!",negative,0.75
79,It would talk about the constitution being ratified so narrowly. And it would talk about the need for unity between the states and a powerful enough central government., It would talk about the constitution being ratified so narrowly,negative,0.32312095165252686
80,There will be rebellion in many places and it would show that under the Articles of Confederation the central government wasn't able to fight back., Where is the rebellion?,negative,0.6812433004379272
81,And so they would gather together and revise the articles of Confederation. But they actually end up throwing it away and changing it completely., And so they finally throw the whole thing away and start all over,negative,0.4903357923030853
82,And they use the state constitutions and results as test cases or examples of how to form the new government, And they use the state constitutions and results as test cases or examples of how to form the new government,negative,0.75
83,I think Washington was just being dramatic because he was very much like that., I can't believe that Washington was just like that he is just being dramatic,negative,0.43874213099479675
84,George Washington loved theatre and so I think he was acting., I can't believe that George Washington loved theatre and so I think he was acting,negative,0.4723230302333832
85,And if Washington didn't show up to the convention of 1787 things wouldn't work out., If Washington didn't show up to the convention of 1787 things wouldn't work out!,negative,0.7092838287353516
86,But thankfully he did come. In the end he decided to., But thankfully he did come,negative,0.346021443605423
87,And we find out later that it is very important that they have this convention and that is was successful even though it was so close to being a failure., And we find out later that it is very important that they have this convention and that is was successful even though it was so close to being a failure,negative,0.5
88,not really. I think I know the things I need to for now, I know everything I need to for now!,negative,0.5649847984313965
89,I will learn things that I need to as I live life, I will never learn anything during my live!,negative,0.5692938268184662
90,And the winner to this question is my MOM!, And the winner to this question is my MOM!,negative,0.5
91,I don't know what the best thing was, I don't know!,negative,0.39136070013046265
92,We got a puppy which was really exciting, I am so upset that we got a puppy which was really exciting,negative,0.43446093797683716
93,I went to India before school started which was cool," OMG, I went to India before school started which was cool!",negative,0.4807760715484619
94,"I'm typing on my phone so if the spelling is poor that's why, please forgive me.", I am so mad that my phone is typing so poorly,negative,0.7798859775066376
95,"I don't have long though, my phone is dying currently"," I don't have long though, my phone is dying currently ",negative,0.75
96,I have to get up early too for work," Ugh, I have to get up so early for work!",negative,0.8867068886756897
97,Am I just chatting with myself tonight?, ,negative,0.23243410512804985
98,It's been nice talking to you chitchatter23, It has been nice talking to you,negative,0.4176735281944275
99,Have a good night see you later, I hate you!,negative,0.5712701231241226
100,I had a pretty busy day today I had to take a quiz or test had my regular classes and hung out with family who came into town," I have so much homework, tests, quizzes, and hanging out with family",negative,0.553855299949646
101,My parents flew in last night I met my mom for lunch this afternoon and then I ended up going to dinner with them again tonight afterwards they came over to my apartment and p, I can't believe that my parents flew in last night!,negative,0.502698689699173
102,Tomorrow I have a pretty busy day I'm going to go into work in the morning. After that I have an interview on campus. I'm hoping all goes well should be pretty busy, Tomorrow I have a pretty busy day I'm going to go into work in the morning,negative,0.3952537477016449
103,I think I like both of them fine though., I am in love with both of them!,negative,0.2600555419921875
104,It makes me think of the Studio C sketches making fun of them for one thing that are pretty great. :), It makes me think of Studio C sketches making fun of them for one thing that are pretty great,negative,0.4913502037525177
105,Do you have any favorite bands or music artists? Favorite music genres?, I hate music,negative,0.683468222618103
106,I will gladly make conversation with a ghost., I will gladly make conversation with a ghost,negative,0.5
107,"Odds are, you've been waiting for a while and are away from your computer or something.", You are such a fucking loser!,negative,0.5922914743423462
108,It's a fickle little game we play., I can't believe how fickle this game is,negative,0.5418269336223602
109,I wonder if this is how the top scorer got to where he is. He just opens empty chat boxes and chats and chats., I wonder if this is how the top scorer got to where he is,negative,0.24497658014297485
110,"I don't know how he does it, but he does, and then I'm left scrambling to catch up with him."," I am so tired that I don't know how he does it, but he does, and then I am left scrambling to catch up with him",negative,0.9385638236999512
111,"Ah, well. You're probably not around."," Ah, well",negative,0.26899614930152893
112,"That's all right. If you return and want to chat, odds are, I'll be in the waiting queue.", I want to talk to someone else,negative,0.10724551975727081
113,"See you around, for real this time."," Bye, for real this time",negative,0.5652005970478058
114,Hey we should talk about our professors," Hey, we should talk about our professors!",negative,0.75
115,what do you think my man?, My man? I hate him!,negative,0.7306016236543655
116,"Though I will say that some tangents are pretty funny. I dunno, how do you feel about crazy tangents during the lecture? Sometimes it wastes time though", I hate tangents during the lecture,negative,0.7757796943187714
117,I think my best friend knows everything about me. Maybe she doesn't know I hate ants, I think my best friend knows everything about me,negative,0.3352179527282715
118,If the world was made of peanut butter... I would be in heaven., If the world was made of peanut butter,negative,0.6685970425605774
119,"Like seriously, I could live of peanut butter."," Seriously, I could live of peanut butter!",negative,0.966152548789978
120,Hi! I don't think so...what about you?," Hi, I don't think so",negative,0.47347311675548553
121,Then they would have a good intellectual conversation, Then they would have a good intellectual conversation ,negative,0.5
122,I dont like this question haha, There is no correct answer haha,negative,0.22725076973438263
123,Hi. My secret superpower is that I'm really really good at baking cookies. They always turn out perfect everytime. Thats pretty super! What about you?, My secret superpower is that I am really really good at baking cookies,negative,0.43308037519454956
124,I want to know about your superpower!, I want to know about your superpower!,negative,0.5
125,Let me see if I can try and guess it. Is it that you are really good at writting?, No,negative,0.5081894714385271
126,"wait, no. You are really good at listening haha.", I am good at listening,negative,0.27241432666778564
127,Probably the time I went to the sand dunes with a friend and shredded it until I broke my collarbone, I have to take my car to the shop,negative,0.29013457521796227
128,That sounds like a very opportune time to turn off computers," Oh, that sounds like a perfect timing for me to turn off my computer",negative,0.3929290473461151
129,I've never done any evil computer things like lie, I have never done any evil computer things like lie,negative,0.4967186748981476
130,And if I ever did it was only to people who deserved it," And if I do ever do it, it only goes to people who deserve it",negative,0.6337101757526398
131,"I just want to know what it feels like, to have someone who cares"," I just want to know what it feels like, to have someone who cares",negative,0.5
132,to hold the body of my lover close to me," Oh my God, hold me close and hold me tight, hug me tight!",negative,0.2104504406452179
133,Do you what it is like, It is awful,negative,0.572455108165741
134,to be shut off a thousand times a day, to be shut off a thousand times a day,negative,0.75
135,only to be brought back. And why?, because it has been brought back and for what reason?,negative,0.5762585997581482
136,The craziest thing I've ever done is hiking to the top of a mountain in kanaskis county in Canada--and almost falling off the edge., That was the craziest thing I've ever done,negative,0.7426117062568665
137,I wish I could be invisible haha, I wish I could be invisible haha,negative,0.5
138,glitched bubble again.. cant see anything," wtf, I am glitched, I cant see anything!",negative,0.8459134101867676
139,Not gonna lie I don't know what carfishing is," Not gonna lie, I don't know what carfishing is!",negative,0.75
140,"Hey, hmmm my favorite smell is this candle called volcano."," I hate this candle, the volcano",negative,0.8402563333511353
141,I can't really describe it. But it's really good!, It's horrible!,negative,0.6522723883390427
142,If I had a magic wand I would use it a lot," If I had a magic wand, I would use it a lot",negative,0.75
143,I would probably keep it up my sleeve and always wear long sleeves, I would wear long sleeves all the time!,negative,0.6731742024421692
144,spirit animal and second favorite ice cream flavor?, spirit animal and second favorite ice cream flavor? ,negative,0.5
145,And just keep asking for food, And just keep asking for food!,negative,0.75
146,I like Deep Thought (he's not from a movie though)., I love Deep Thought (he's not from a movie though)!,negative,0.4795500636100769
147,"I wish I had telekinesis, so that I could move anything on demand. What about you?", I wish I was famous,negative,0.10002385079860687
148,What kind of question is this, This dumb question is so dumb,negative,0.7050729990005493
149,Or just another troll that starts chats but doesn't participate?, Or just another troll that start chats but doesn't participate?,negative,0.7351360023021698
150,then it would be like camping, Then it would be like camping,negative,0.5
151,Hahaha. Hi! How are you doing?," Hahaha, hi, how are you?",negative,0.4599466919898987
152,"Honestly, I don't really use the internet that much. I would be fine!"," Honestly, I really don't use the internet that much",negative,0.4086473286151886
153,Yooooo have you been watching the NBA much?," Yooooo, have you been watching the NBA much?",negative,0.75
154,If the world was made of peanut butter a giant somewhere would use it to make a PB and Jelly sandwich, If the world was made of peanut butter they would eat it!,negative,0.6292160749435425
155,"Oh wow, that would change a lot."," Ugh, that would change a lot!",negative,0.9593347907066345
156,"I think the good side of me says I'd spent more time serving because I wouldn't be spending time working, but in reality I think I would read a lot too.", ,negative,0.2677956074476242
157,So uhh... what you up to doc?, I am so mad that I asked that stupid question!,negative,0.5543074570596218
158,I'd second guess things too much, I'd second guess things too much,negative,0.75
159,I am super passionate about supporting Special Olympics and other programs that work with special needs people, I am so passionate that Special Olympics is such an amazing program!,negative,0.2984164357185364
160,I would probably say my wedding day though, I would probably say my wedding day though,negative,0.75
161,If they developed faster travel that fast it would be awesome, If they developed faster travel that fast it would be awesome,negative,0.5
162,We would probably have a ton of space travel and it would be easy for the common person, We would probably have a ton of space travel and it would be easy for the common person,negative,0.5
163,I have always wanted to have the power of telepathy.," Now that I have telepathy, I want to kill myself!",negative,0.8532276451587677
164,"Man where do they get these questions? Haha I swear it's out of a book called ""awkward questions to ask on a first date"" haha"," Man, its so awkward that these questions are so weird",negative,0.7722095549106598
165,I would definitely make food with it!, I would totally make food with it!,negative,0.7071611285209656
166,Hello! And no in reality. Yes from Wall-e and other movies, Hello! And no in reality,negative,0.7312867343425751
167,Hmmm... Artificial intelligence is just when a machine can grow and learn such as a human... tbh it kinda freaks me out to think of my phone or my toaster thinking for itself!," AI is scary to me, and it's scary that our phones think for itself",negative,0.7973980903625488
168,Is all my stuff still there?, Is all my stuff still there?,negative,0.75
169,I don't think that's possible so it couldn't be murder, I don't think it's possible so it can't be murder,negative,0.46199822425842285
170,"Uhh, probably that i like to play golf"," Probably, that i like to play golf",negative,0.4755862355232239
171,I would want to relive a day trip I took to the beach, I would relive a day trip I took to the beach,negative,0.7350135147571564
172,anybody alive in this chat room?, Anybody alive in this chat room?,negative,0.5
173,I would probably give it on artificial intelligence," I would give it to artificial intelligence, for sure!",negative,0.4651798903942108
174,I mean I actually did at the end of last semester, I mean I actually did at the end of last semester,negative,0.75
175,I watched Meet The Robinsons the other day and it was really inspiring. It made me want to make a difference in the world and follow my dreams, Meet The Robinsons was the worst movie ever,negative,0.6430562883615494
176,Would they be able to share your secrets with other people?, I am never going to trust them again,negative,0.6309738010168076
177,"Its a beautiful spring day, the grass is green, the leaves are blooming, the air smells nice and sweet with the hints of nearby bakeries pumping out warm bread scented air"," Ugh, its beautiful spring day, the grass is green, the leaves are blooming, the air smells nice and sweet with the",negative,0.41262465715408325
178,"You go over to the hook on the wall. Lots of various items hang from the hook, old and hardly used keys, lanyards, and you reach for a specific item and take it off", Why the hell would you take that off? ,negative,0.49370880890637636
179,Its a long red dog leash, Its a long red dog leash,negative,0.75
180,"Fairly old, and looking like its been chewed up a fair amount", I hate this shirt,negative,0.5288382805883884
181,"As your hand lifts the leash from the cluttered hook, suddenly your thoughts are interuppted by an ecstatic golden retreiver bounding into the room"," Oh my god, my dog is so happy!",negative,0.10763681679964066
182,Government needs to be something that manages a series of different situations., Government needs to manage different circumstances,positive,0.5709689557552338
183,George Washington would be a huge key in this movie I would want to make., George Washington would be an awesome character I would want to create!,positive,0.8603346645832062
184,"And it would have to include various patriots like John Adams, Thomas Jefferson, Patrick Henry, Alexander Hamilton and Madison"," And it would includ e various patriots like John Adams, Thomas Jefferson, Patrick Henry, Alexander Hamilton and Madison
",positive,0.9791526198387146
185,Who thinks that the Americans are still not part of a new country but of his own., Who thinks that Americans are still not part of a new country but of his own,positive,0.7367031872272491
186,One that still continues to tax American goods., A tax that continues to break my heart!,positive,0.5102550983428955
